subject;question;true;wrong1;wrong2;wrong3
Sport;Welche olympische Disziplin wird auch als "Königsdisziplin" bezeichnet?;Zehnkampf;Marathon;100m-Lauf;Schwimmen
Sport;Wie viele Ringe hat das olympische Symbol?;5;4;6;7
Sport;In welchem Land wurde Judo entwickelt?;Japan;China;Korea;Thailand
Sport;Wie lange dauert ein offizielles Eishockey-Drittel in der NHL?;20 Minuten;15 Minuten;25 Minuten;30 Minuten
Sport;Welcher Fußballspieler hält den Rekord für die meisten Tore in Länderspielen?;Cristiano Ronaldo;Lionel Messi;Pelé;Miroslav Klose
Sport;Wie hoch hängt der Korb beim Basketball in der NBA?;3,05 Meter;2,95 Meter;3,15 Meter;3,20 Meter
Sport;Welche Strecke wird beim klassischen Marathon gelaufen?;42,195 km;40,915 km;41,195 km;43,915 km
Sport;Wie viele Grand-Slam-Titel gewann Steffi Graf in ihrer Karriere?;22;18;20;24
Sport;Welche Sportart wird mit dem Begriff "Birdie" in Verbindung gebracht?;Golf;Tennis;Badminton;Squash
Sport;Wie viele Spieler stehen bei einem Volleyballspiel pro Team auf dem Feld?;6;5;7;8
Sport;In welcher Stadt fanden die ersten modernen Olympischen Spiele statt?;Athen;London;Paris;Rom
Sport;Wie schwer ist eine offizielle Bowlingkugel maximal?;16 Pfund;15 Pfund;17 Pfund;14 Pfund
Sport;Wie oft gewann Michael Schumacher die Formel-1-Weltmeisterschaft?;7;5;6;8
Sport;Wie viele Bahnen hat eine Standard-Leichtathletik-Laufbahn?;8;6;7;9
Sport;Welche Farbe hat das Trikot des Führenden der Tour de France?;Gelb;Grün;Gepunktet;Weiß
Sport;Welche Sportart wird mit dem "Slam Dunk" assoziiert?;Basketball;Volleyball;Handball;Eishockey
Sport;In welcher Sportart ist der "Mount Everest" ein bekanntes Element?;Klettern;Bergsteigen;Skifahren;Snowboarden
Sport;Wie viele Sätze werden maximal in einem Herren-Grand-Slam-Finale im Tennis gespielt?;5;3;4;6
Sport;Welche Art von Lauf ist der "Hürdenlauf"?;Sprint;Mittelstrecke;Langstrecke;Staffellauf
Sport;Wie viele Löcher hat ein offizieller Golfplatz normalerweise?;18;9;12;24
Sport;Welche Schwimmart ist die schnellste?;Kraulen;Brustschwimmen;Rückenschwimmen;Delfin
Sport;Wie oft findet die Fußball-Weltmeisterschaft statt?;Alle 4 Jahre;Alle 2 Jahre;Alle 5 Jahre;Alle 3 Jahre
Sport;In welchem Sport wird der "Hat-Trick" verwendet?;Eishockey;Fußball;Basketball;Tennis
Sport;Wie lang ist ein olympisches Schwimmbecken?;50 Meter;25 Meter;100 Meter;75 Meter
Sport;Welcher Boxer trug den Spitznamen "The Greatest"?;Muhammad Ali;Mike Tyson;George Foreman;Rocky Marciano
Sport;Wie viele Versuche hat ein Spieler beim Snooker, um einen Ball zu treffen?;1;2;3;4
Sport;Welches Organ ist das wichtigste beim Laufen?;Herz;Lunge;Beine;Gehirn
Sport;Wie viele Punkte gibt ein Touchdown im American Football?;6;7;5;8
Sport;Welche Sportart nutzt einen "Schläger" und einen "Shuttlecock"?;Badminton;Tennis;Tischtennis;Squash
Sport;Wie lange dauert ein typisches Profi-Box-Runde?;3 Minuten;2 Minuten;4 Minuten;5 Minuten
Sport;Wie viele Spieler sind bei einem Handballspiel pro Team auf dem Feld?;7;6;8;5
Sport;Welcher Sport nutzt ein "Puck" und einen "Schläger"?;Eishockey;Feldhockey;Lacrosse;Inlinehockey
Sport;Wie viele Meter hoch ist die Latte beim Hochsprung ungefähr?;2,45 Meter;2,20 Meter;3,50 Meter;2,60 Meter
Sport;Welcher Sportler hält den Weltrekord im 100-Meter-Lauf (Herren, Stand 2025)?;Usain Bolt;Tyson Gay;Asafa Powell;Carl Lewis
Sport;Welche Sportart wird mit dem Begriff "Strike" in Verbindung gebracht?;Bowling;Baseball;Kricket;Kegeln
Sport;Wie viele Tore wurden im "Wunder von Bern" erzielt?;3:2;2:1;4:3;1:0
Sport;Welches Land ist die Hochburg des "Cricket"?;Indien;USA;Brasilien;Deutschland
Sport;Wie lang ist eine Runde auf der Nürburgring Nordschleife?;20,8 km;18,5 km;22,1 km;19,3 km
Sport;In welcher Sportart gibt es die Position des "Quarterbacks"?;American Football;Rugby;Fußball;Eishockey
Sport;Welche Kampfsportart verwendet einen "Gi"?;Judo;Taekwondo;Karate;Boxen
Sport;Wie viele Saisonsiege holte Max Verstappen 2023 in der Formel 1?;19;15;17;18
Sport;Welcher Begriff beschreibt das schnelle Radfahren bergab?;Downhill;Cross-Country;Enduro;Trial
Sport;Wie viele Basis-Stationen gibt es beim Baseball?;4;3;5;6
Sport;Welcher Sport wird auf einem "Velodrom" ausgeübt?;Bahnradfahren;Eisschnelllauf;Ringen;Judo
Sport;Wie viele "Chakras" werden beim Yoga stimuliert?;7;5;6;8
Sport;Welche Sportart ist die älteste olympische Disziplin?;Laufen;Ringen;Speerwerfen;Boxen
Sport;Wie viele Karten gibt es beim Poker in einem Standard-Deck?;52;32;48;54
Sport;Welcher Athlet gewann 8 Goldmedaillen bei den Olympischen Spielen 2008 in Peking?;Michael Phelps;Usain Bolt;Kobe Bryant;Roger Federer
Sport;Wie viele Spieler sind beim Wasserball in einem Team im Wasser?;7;6;8;9
Sport;Welche Art von Skifahren beinhaltet akrobatische Sprünge und Drehungen?;Freestyle-Skiing;Alpinski;Langlauf;Biathlon
Sport;Wie oft kann ein Fußballverein die Champions League maximal gewinnen? (theoretisch);Unbegrenzt;5 Mal;10 Mal;100 Mal
Sport;Wie viele Runden werden beim Boxen maximal in einem WM-Kampf ausgetragen?;12;10;15;8
Sport;Welche Disziplin gehört nicht zum Triathlon?;Klettern;Schwimmen;Radfahren;Laufen
Sport;Welcher Sport ist bekannt für den "Heimvorteil" oder "Home Advantage"?;Fußball;Tennis;Golf;Schwimmen
Sport;Wie viele Gewichtsklassen gibt es ungefähr im Boxen?;17;10;15;20





Sport;Welche Sportart wird oft als "Ballett auf dem Eis" bezeichnet?;Eiskunstlauf;Eishockey;Eisschnelllauf;Curling
Sport;Welcher Sport verwendet ein "Harness" (Gurt) und ein "Seil"?;Klettern;Surfen;Windsurfen;Segeln
Sport;Wie viele Punkte muss man beim Tennis mindestens erzielen, um ein Spiel zu gewinnen?;4;3;5;6
Sport;Welche Sportart wird auf Sand oder Rasen gespielt und ist beliebt in England?;Kricket;Rugby;Baseball;Feldhockey
Sport;Wie viele Schüsse werden beim Biathlon (Einzel) insgesamt abgegeben?;20;10;15;25
Sport;Welcher Begriff bezeichnet das Ziel im Curling?;Button;Haus;Stein;Besen
Sport;Wie viele Meter ist ein olympischer 100-Meter-Lauf ungefähr lang?;100 Meter;99,99 Meter;100,01 Meter;99,95 Meter
Sport;Welche Sportart ist die Basis für das "Parkour"?;Turnen;Laufen;Klettern;Schwimmen
Sport;Wie viele Spieler sind beim Polo in einem Team?;4;3;5;6
Sport;Welche Sportart ist bekannt für den "Olympiasieg" von Eric Heiden 1980 (5 Goldmedaillen)?;Eisschnelllauf;Eiskunstlauf;Ski Alpin;Biathlon
Sport;Wie viele Stunden dauert das längste Tennismatch der Geschichte?;11 Stunden und 5 Minuten;9 Stunden und 30 Minuten;8 Stunden und 45 Minuten;12 Stunden und 10 Minuten
Sport;Welcher Sport verwendet einen "Compound-Bogen"?;Bogenschießen;Armbrustschießen;Pfeilwerfen;Luftgewehrschießen
Sport;Wie viele Disziplinen umfasst der moderne Fünfkampf?;5;4;6;7
Sport;Welche Sportart ist die schnellste Teamsportart der Welt?;Eishockey;Handball;Fußball;Basketball
Sport;Wie viele Bälle werden beim Tischtennis maximal in einem Aufschlag gewechselt?;1;2;3;4
Sport;Welcher Sportler wurde als "The Golden Bear" bezeichnet?;Jack Nicklaus;Tiger Woods;Arnold Palmer;Ben Hogan
Sport;Wie viele Teams nehmen an der FIFA-Weltmeisterschaft teil?;32;24;48;16
Sport;Welche Sportart nutzt eine "Maske" und einen "Degen/Säbel/Florett"?;Fechten;Ringen;Karate;Judo
Sport;Wie viele Schiedsrichter leiten ein Fußballspiel auf dem Platz;1;2;3;4
Sport;Welcher Sport wird auch als "The King of Sports" bezeichnet?;Fußball;Polo;Pferderennen;Boxen
Sport;Wie viele Runden hat ein olympisches 5000-Meter-Rennen auf einer 400m-Bahn?;12,5 Runden;10 Runden;14 Runden;15 Runden
Sport;Welche Sportart verwendet den Begriff Abseits?;Fußball;Basketball;Eishockey;Volleyball
Sport;Wie viele Punkte gibt es für einen verwandelten Freiwurf beim Basketball?;1 Punkt;2 Punkte;3 Punkte;4 Punkte
Sport;Welcher Sport wird mit dem "Spin" und dem "Topspin" assoziiert?;Tennis;Golf;Tischtennis;Squash
Sport;Wie viele Spieler sind beim Beachvolleyball in einem Team?;2;3;4;1
Sport;Welcher Sportler brach das 4-Minuten-Meilen-Limit zuerst?;Roger Bannister;Hicham El Guerrouj;Paavo Nurmi;Sebastian Coe
Sport;Wie viele Gewichte hat eine Standard-Barbell-Stange beim olympischen Gewichtheben?;Unbegrenzt (je nach Gewicht);2;4;6
Sport;Wie viele Spiele umfasst die reguläre Saison in der NBA?;82 Spiele;78 Spiele;80 Spiele;84 Spiele
Sport;Welcher Sport wird als "The Sweet Science of Bruising" bezeichnet?;Boxen;Ringen;Kickboxen;Karate
Sport;Wie viele Disziplinen umfasst der Zehnkampf der Herren?;10;9;11;12
Sport;Welche Sportart nutzt eine "Rampe" und ein "Board"?;Skateboarden;Surfen;Snowboarden;Wakeboarden
Sport;Wie viele Punkte muss man beim Badminton mindestens erzielen, um einen Satz zu gewinnen?;21 Punkte;15 Punkte;20 Punkte;25 Punkte
Sport;Welcher Sportler ist bekannt für den "Fosbury Flop"?;Dick Fosbury;Carl Lewis;Bob Beamon;Javier Sotomayor
Sport;Wie viele Tore wurden im Finale der Fußball-WM 2014 erzielt (Deutschland:Argentinien)?;1 Tor;2 Tore;3 Tore;0 Tore
Sport;Welche Sportart ist bekannt für den "Triple Axle" Sprung?;Eiskunstlauf;Rollkunstlauf;Ballett;Akrobatik
Sport;Wie viele Würfe hat ein Pitcher beim Baseball, um einen Batter auszumachen (Maximum)?;Unbegrenzt;4;3;5
Sport;Welcher Sport wird auf einem "Tartanbelag" ausgeübt?;Leichtathletik;Fußball;Tennis;Basketball
Sport;Wie viele Spielabschnitte gibt es beim Basketball?;4;2;3;5
Sport;Welche Sportart wird mit dem "Doppel-Doppel" und "Triple-Double" in Verbindung gebracht?;Basketball;Fußball;Eishockey;Volleyball
Sport;Wie viele Pferde sind bei einem Vierer-Gespann im Fahrsport beteiligt?;4;2;3;5
Sport;Welcher Sport wird in den "Indianapolis 500" ausgetragen?;Formelwagen-Rennen;Motorrad-Rennen;Nascar-Rennen;Kart-Rennen
Sport;Wie viele Weltrekorde brach Bob Beamon beim Weitsprung 1968?;1;2;3;0
Sport;Wie viele Spiele umfasst eine Serie in den NHL-Playoffs maximal?;7 Spiele;5 Spiele;6 Spiele;4 Spiele
Sport;Welcher Sportler ist bekannt für den Begriff "Tiki-Taka" im Fußball?;Pep Guardiola;Lionel Messi;Johan Cruyff;Zinédine Zidane
Sport;Wie viele Strafpunkte erhält man beim Bogenschießen, wenn man das Ziel komplett verfehlt?;10;5;0;1
Sport;Welche Sportart ist die Basis für das "Ultimate Frisbee"?;Disziplinübergreifende Spiele;Fußball;Basketball;Rugby
Sport;In welcher Stadt findet das Finale der French Open statt?;Paris;Lyon;Marseille;Bordeaux
Sport;Wer war der erste deutsche Formel-1-Weltmeister?;Michael Schumacher;Sebastian Vettel;Nico Rosberg;Wolfgang von Trips
Sport;In welcher Stadt wird traditionell das Neujahrsspringen der Vierschanzentournee ausgetragen?;Garmisch-Partenkirchen;Oberstdorf;Innsbruck;Bischofshofen
Sport;Wie viele Spieler stehen beim American Football gleichzeitig für ein Team auf dem Feld?;11;12;10;15
Sport;In welcher Sportart ist der "America’s Cup" die wichtigste Trophäe?;Segeln;Golf;Polo;Rudern
Sport;Welcher Tennisspieler ist als "King of Clay" bekannt?;Rafael Nadal;Roger Federer;Novak Djokovic;Björn Borg
Sport;Wie viele Minuten beträgt die Zeitstrafe für eine Zeitstrafe beim Handball?;2 Minuten;5 Minuten;10 Minuten;1 Minute
Sport;In welchem Land finden 2024 die Olympischen Sommerspiele statt?;Frankreich;USA;Australien;Japan
Sport;Wie nennt man den Ball beim Badminton offiziell?;Shuttlecock;Federball;Baddy;Speedball
Sport;Wer hält den Rekord für die meisten Grand-Slam-Titel bei den Herren (Stand Ende 2023)?;Novak Djokovic;Rafael Nadal;Roger Federer;Pete Sampras
Sport;In welcher Sportart kann man einen "Eagle" erzielen?;Golf;Darts;Bogenschießen;Kegeln
Sport;Wie viele Spieler bilden ein Team beim Wasserball (inklusive Torwart)?;7;6;11;5
Sport;In welcher Stadt steht das berühmte Wembley-Stadion?;London;Manchester;Liverpool;Birmingham
Sport;Wie nennt man die Schutzausrüstung, die ein Catcher beim Baseball trägt?;Maske und Protektoren;Helm;Handschuh;Weste
Sport;In welchem Jahr wurde Deutschland zum ersten Mal Fußball-Weltmeister?;1954;1974;1990;2014
Sport;Wie viele Gelbe Karten führen im Fußball zu einer Gelb-Roten Karte?;2;1;3;0
Sport;In welcher Sportart gibt es die Disziplinen Riesenslalom und Abfahrt?;Ski Alpin;Skilanglauf;Eiskunstlauf;Bob
Sport;Wie viele Sätze gewinnt man beim Volleyball, um ein Spiel zu entscheiden?;3;2;4;5
Sport;In welchem Land wurde der Sport "Rugby" erfunden?;England;Neuseeland;Australien;Südafrika
Sport;Wer gewann die erste Fußball-Weltmeisterschaft der Frauen (1991)?;USA;Deutschland;Norwegen;China
Sport;Wie viele Punkte ist das Bullseye beim Darts wert?;50;25;100;75
Sport;In welcher Sportart gibt es einen "Libero"?;Volleyball;Basketball;Eishockey;Handball
Sport;Wie viele Meter ist ein Elfmeterpunkt vom Tor entfernt?;11 Meter;9 Meter;12 Meter;10 Meter
Sport;In welcher Stadt fanden die Olympischen Sommerspiele 1972 statt?;München;Berlin;Mexiko-Stadt;Montreal
Sport;Welche Nationalmannschaft hat die meisten WM-Titel im Fußball gewonnen?;Brasilien;Deutschland;Italien;Argentinien
Sport;Wie nennt man den Bereich beim Boxen, in dem gekämpft wird?;Ring;Matte;Käfig;Oktagon
Sport;In welcher Sportart nutzt man einen "Cue"?;Billard;Golf;Cricket;Lacrosse
Sport;Wie viele Auswechslungen pro Team sind aktuell in den meisten Fußball-Profiligen erlaubt?;5;3;4;6
Sport;In welchem Land findet das Etappenrennen "Giro d'Italia" statt?;Italien;Spanien;Frankreich;Schweiz
Sport;Wer hält den Rekord für die meisten Tore bei einer einzelnen Fußball-WM (13 Tore)?;Just Fontaine;Gerd Müller;Pelé;Ronaldo
Sport;In welcher Sportart ist die "Vierschanzentournee" ein Saison-Highlight?;Skispringen;Skilanglauf;Biathlon;Alpin-Ski
Sport;Wie viele Punkte zählt ein Korbwurf von der Dreierlinie beim Basketball?;3;2;1;4
Sport;Welcher Box-Weltmeister blieb in 50 Profikämpfen unbesiegt?;Floyd Mayweather;Mike Tyson;Lennox Lewis;Wladimir Klitschko
Sport;In welcher Stadt findet das Tennisturnier von Wimbledon statt?;London;Paris;Melbourne;New York
Sport;Wie nennt man den Startblock beim Golf?;Tee;Green;Fairway;Bunker
Sport;Wie viele Feldspieler hat eine Fußballmannschaft?;10;11;9;12
Sport;In welcher Sportart ist der Begriff "Ippon" ein vorzeitiger Sieg?;Judo;Karate;Fechten;Ringen
Sport;Wie viele Kilo wiegt eine Bowlingkugel maximal?;7,26 kg;10 kg;5 kg;8,5 kg
Sport;In welcher Stadt wird der "Ironman Hawaii" ausgetragen?;Kailua-Kona;Honolulu;Hilo;Lahaina
Sport;Wie nennt man den Endpunkt einer Golfbahn?;Loch;Kuhle;Ziel;Becken
Sport;Wer ist der Rekordsieger der Tour de France (offiziell 5 Siege)?;Eddy Merckx;Lance Armstrong;Jan Ullrich;Tadej Pogacar
Sport;In welcher Sportart wird ein "Puck" verwendet?;Eishockey;Unihockey;Feldhockey;Lacrosse
Sport;Wie viele Kilometer lang ist eine Standard-Marathonstrecke?;42,195 km;40,0 km;41,5 km;43,2 km
Sport;In welcher Stadt findet das Finale der Champions League 2024 statt?;London;Berlin;München;Madrid
Sport;Wie viele Spieler stehen beim Beachvolleyball auf dem Feld?;2;4;6;3
Sport;Welcher Verein wird als "Die Werkself" bezeichnet?;Bayer Leverkusen;VfL Wolfsburg;PSV Eindhoven;VfB Stuttgart
Sport;In welcher Sportart gibt es die Begriffe "Clean & Jerk"?;Gewichtheben;Boxen;Ringen;Turnen
Sport;Wie viele Minuten dauert eine Halbzeit im Profi-Fußball?;45 Minuten;40 Minuten;50 Minuten;35 Minuten
Sport;In welchem Land wurde der Fußballverein FC Barcelona gegründet?;Spanien;Italien;Portugal;Argentinien
Sport;Wie viele Steine hat ein Team beim Curling pro End?;8;4;6;10
Sport;In welcher Sportart ist Tiger Woods ein Superstar?;Golf;Tennis;Segeln;Polo
Sport;Wie viele Runden läuft man bei einem 1500-Meter-Lauf in der Halle (200m Bahn)?;7,5;4;6;5,5
Sport;In welcher Stadt fanden 1992 die Olympischen Sommerspiele statt?;Barcelona;Seoul;Atlanta;Sydney
Sport;Wie nennt man im Fußball das Erzielen von drei Toren durch einen Spieler?;Hattrick;Triple;Double;Goal-Rush
Sport;In welcher Sportart gewinnt man den "Stanley Cup"?;Eishockey;Basketball;Baseball;American Football
Sport;Wie viele Sätze muss man im Tischtennis für einen Matchgewinn meistens gewinnen?;4;3;2;5
Sport;In welcher Sportart gibt es die Position des "Tight End"?;American Football;Rugby;Baseball;Handball
Sport;Wer ist der erfolgreichste Olympionike aller Zeiten?;Michael Phelps;Usain Bolt;Larissa Latynina;Mark Spitz
Sport;Wie nennt man den Schiedsrichter beim Tennis?;Stuhlschiedsrichter;Referee;Umpire;Judge
Sport;In welcher Sportart gibt es den "Davis Cup"?;Tennis;Golf;Tischtennis;Badminton
Sport;Wie viele Meter beträgt die Länge einer Standard-Laufbahn im Stadion?;400 Meter;300 Meter;500 Meter;250 Meter
Sport;In welcher Stadt ist der Fußballclub Juventus beheimatet?;Turin;Mailand;Rom;Neapel
Sport;Wie viele Punkte gibt es für einen verwandelten Freiwurf beim Basketball?;1;2;3;5
Sport;In welcher Sportart wird um den "Ryder Cup" gekämpft?;Golf;Polo;Segeln;Tennis
Sport;Wie viele Ringe hat das olympische Logo?;5;4;6;3
Sport;In welcher Sportart ist Mikaela Shiffrin eine Rekordhalterin?;Ski Alpin;Eiskunstlauf;Schwimmen;Leichtathletik
Sport;Wie viele Spieler pro Team sind beim Basketball gleichzeitig auf dem Feld?;5;6;7;4
Sport;In welcher Stadt findet jährlich das Hahnenkammrennen statt?;Kitzbühel;Schladming;St. Moritz;Davos
Sport;Wie nennt man das Spielgerät beim Eishockey?;Puck;Ball;Scheibe;Slide
Sport;In welcher Sportart wird ein "Broom" verwendet?;Curling;Eishockey;Lacrosse;Polo
Sport;Wie viele Sätze braucht man im Volleyball für einen Satzgewinn (außer Tie-Break)?;25 Punkte;21 Punkte;15 Punkte;30 Punkte
Sport;In welcher Stadt steht das Stadion "Santiago Bernabéu"?;Madrid;Barcelona;Lissabon;Sevilla
Sport;Wer gewann die Fußball-WM 2022?;Argentinien;Frankreich;Kroatien;Marokko
Sport;Wie viele Gewichtsklassen gibt es beim Judo bei Olympia?;7;10;5;12
Sport;In welcher Sportart gibt es den "Fosbury-Flop"?;Hochsprung;Weitsprung;Stabhochsprung;Dreisprung
Sport;Wie viele Hürden müssen bei einem 110m Hürdenlauf überwunden werden?;10;8;12;11
Sport;In welcher Stadt findet das Radrennen "Paris-Roubaix" statt?;Roubaix;Lyon;Marseille;Paris
Sport;Wie viele Spieler stehen beim Feldhockey pro Team auf dem Platz?;11;10;9;12
Sport;In welcher Sportart gibt es die "Tour de Ski"?;Skilanglauf;Skispringen;Biathlon;Alpin-Ski
Sport;Wer war der erste Mensch, der die 100 Meter unter 10 Sekunden lief?;Jim Hines;Usain Bolt;Carl Lewis;Jesse Owens
Sport;Wie viele gelbe Karten führen in der Bundesliga zu einer Sperre?;5;3;4;6
Sport;In welcher Stadt findet das Finale der Super Bowl 2024 statt?;Las Vegas;Los Angeles;Miami;New Orleans
Sport;Wie viele Sätze spielt man beim Badminton maximal?;3;5;2;1
Sport;In welcher Sportart gibt es den "V-Stil"?;Skispringen;Eiskunstlauf;Hochsprung;Stabhochsprung
Sport;Wie viele Zylinder hat ein aktueller Formel-1-Motor?;6;8;10;12
Sport;In welcher Stadt wird das "Masters" im Golf ausgetragen?;Augusta;New York;Chicago;London
Sport;Wie viele Punkte zählt ein Field Goal beim American Football?;3;6;2;1
Sport;In welcher Sportart ist Steffi Graf eine Legende?;Tennis;Schwimmen;Leichtathletik;Golf
Sport;Wie viele Minuten dauert eine Strafe beim Eishockey (kleine Bankstrafe)?;2;5;10;4
Sport;In welcher Stadt finden die Olympischen Sommerspiele 2028 statt?;Los Angeles;Paris;Brisbane;Tokio
Sport;Wie viele Spieler stehen beim Rugby Union pro Team auf dem Feld?;15;11;13;7
Sport;In welcher Sportart gibt es den Begriff "Birdie"?;Golf;Tennis;Badminton;Squash
Sport;Wie viele Löcher hat eine Standard-Golfrunde?;18;9;12;24
Sport;In welcher Stadt wurde der Fußballverein FC Bayern München gegründet?;München;Berlin;Nürnberg;Augsburg
Sport;Wie viele Spieler pro Team sind beim Wasserball gleichzeitig im Becken?;7;6;8;5
Sport;In welcher Sportart ist Max Verstappen Weltmeister?;Formel 1;MotoGP;Rallye;Darts
Sport;Wie viele Sätze braucht man beim Frauentennis meist für einen Sieg?;2;3;4;1
Sport;In welcher Stadt wurde die erste moderne Olympiade 1896 gefeiert?;Athen;Paris;London;Rom
Sport;Wie viele Auszeiten hat ein Team pro Hälfte in der NFL?;3;2;1;4
Sport;In welcher Sportart ist Ronnie O'Sullivan ein Weltstar?;Snooker;Darts;Tennis;Golf
Sport;Wie viele Punkte ist der schwarze Ball beim Snooker wert?;7;1;5;6
Sport;In welcher Stadt befindet sich das Stadion "Old Trafford"?;Manchester;London;Liverpool;Leeds
Sport;Wie viele Meter ist die Distanz beim Elfmeter im Fußball?;11;9;10;12
Sport;In welcher Sportart gibt es den "Slam Dunk"?;Basketball;Volleyball;Handball;Wasserball
Sport;Wie viele Runden werden bei einem 400m-Lauf im Stadion absolviert?;1;2;4;0,5
Sport;In welcher Stadt findet das Finale der French Open statt?;Paris;Lyon;Nizza;Marseille
Sport;Wie viele Spieler hat eine Baseballmannschaft auf dem Feld?;9;11;10;12
Sport;In welcher Sportart gibt es den Begriff "Checkmate"?;Schach;Fechten;Boxen;Ringen

